,IMDB,RT,Direccion,Guión,Argumento,Duración,Título
97,6.8,--,Luciano Martino,Luciano MartinoSauro Scavolini,An advertiser who lives in Milan learns from a former teacher that his mother is dying. He leaves immediately in his car; as he drives thinks back to his childhood and the time he believed his mother had a relationship with the teacher.,1h 41m,Nel giardino delle rose
98,6.3,--,Kazuyuki Izutsu,Akira AsaiKazuyuki Izutsu,"Yoshiaki Masaki left his family for a career as designer in Tokyo. After his father's death he quits job and girlfriend and returns in the small town to take over the family's weaving mill. However his mother has already sold it - against his will. Stuck in the provinces, he seeks to establish a new company against heavy competition and with none of his relatives beli... Read all",1h 59m,Uchuu no hosoku
99,5.4,--,John Dingwall,John Dingwall,"Drama about couple with no love. They constantly argue with each other and woman, which suffers from agoraphobia, trying to get out of that circle.",1h 25m,Phobia
100,3.5,--,K. Bapaiah,Mithun ChakrabortyMadhuri DixitBharat Bhushan,"After the death of their parents, Vijay takes it upon himself to look after his sisters Sharda, Sujata and Sangeeta until they became old enough to take care of the house while working as a mechanic. After attaining adulthood Vijay gets Sharda married to Inspector Arun; while Sujata gets married to Advocate Gopal and Sangeeta gets to marry her boyfriend. The sisters w... Read all",2h 28m,Pyar Ka Devta
101,7.5,--,Dimitris Spyrou,Dimitris Spyrou,"""O Psyllos"" (The Flea) is the title of a newspaper, published by a 12-year-old student, Elias, who lives in a small village on highland Olympia. His dream and its pursuit are thriftily but beautifully illustrated, along with the rural life of the '60s in Greece.",1h 48m,O Psyllos
102,6.8,--,Sergei Ovcharov,Sergei OvcharovMikhail Saltykov-Shchedrin,"The bureaucratic epos on dialogues and M.E.Saltykova-Shchedrina's plots, life of the city of Glupov led by petty tyrants - city's mayors.",2h 4m,Ono
103,5.7,33%,Sondra Locke,John DeMarcoLeigh Chapman,"Lottie is a vice cop in LA posing as a hooker and likes the action. She meets Stan, who's also single. He needs her for a major drug bust.",1h 49m,Impulse
104,7.4,--,Giles Walker,Joe WiesenfeldMark Schreiber,"Diagnosed as having a brain tumor, seventeen-year-old Ryan is angrily resigned to the fact that he may not live to see another year. With time running out, he clings to two goals: publishing his journal and losing his virginity. But as Ryan finds fresh strength from his new friends' optimism and defiant refusal to surrender to cancer, his perspective changes.",1h 43m,Princes in Exile
105,6.9,--,Víctor Gaviria,Juan Guillermo ArredondoLuis Fernando CalderónRamón Correa,"Rodrigo and his friends are bored teenagers living in Medellin. Rodrigo wants to start a punk band. The youths mainly loaf around the hillside shanty towns and, for kicks, steal a bike or car, or shoot someone.",1h 33m,Rodrigo D: No futuro
106,6.5,--,Raymond Depardon,Raymond Depardon,A Frenchwoman is taken hostage by an African tribe for months - can she escape ?,1h 36m,Captive of the Desert
107,5.6,27%,Francesco Rosi,Francesco RosiGore VidalTonino Guerra,"A candidate for the Mayor of New York City promises to legalize drugs. The mafia, making insane money on illegal drug trade, is about to dissuade him - at all cost.",1h 40m,The Palermo Connection
108,5.9,--,Bassek Ba Kobhio,Bassek Ba Kobhio,"Sango Malo contrasts two views of education. The traditional headmaster represents a rigid, ""Eurocentric."" curriculum designed to produce docile colonial administrators. Malo, the radical young teacher, emphasizes the practical skills needed to build a self-reliant rural community. The film illustrates Brazilian educator Paolo Freire's celebrated distinction between a... Read all",1h 33m,Sango Malo
109,4.9,--,Serge Gainsbourg,Serge Gainsbourg,"The story of Stan, a misunderstood poet, who makes a living teaching English to schoolchildren while writing a screenplay on the side.",1h 7m,Stan the Flasher
110,5.8,60%,Axel Corti,Jacques TournierDerek MarloweDaniel Vigne,"Set in the seventeenth century, an Italian nobleman weds an impoverished countess, who is wooed by the King of Piedmont and faces pressure from his entire court to succumb to his wishes.",1h 33m,The King's Whore
111,7.2,--,Daoud Abdel Sayed,Daoud Abdel Sayed,Innocent and naive Youssef meets a multi-faceted personality millionaire called Sayyid Marzuq.,1h 25m,Al-bahths an Al-Sayyid Marzuq
112,6.0,--,Jean Beaudry,Jean BeaudryStella Goulet,"Two girl pen pals and a simple summer in the country. They befriend a woman rumored to be a witch, and end up as amateur detectives when her pet pig is stolen.",1h 35m,Pas de répit pour Mélanie
113,7.5,83%,Xavier Koller,Xavier KollerFeride Çiçekoglu,The story of a poor Turkish family who try to emigrate illegally to Switzerland.,1h 45m,Journey of Hope
114,7.2,--,Armondo Linus Acosta,William ShakespeareArmondo Linus AcostaVictor Spinetti,An eccentric bag lady rescues the stray cats of Venice and puts them on a boat to set sail for the New World.,--,Romeo.Juliet
115,5.0,40%,Bernard Rose,David Yallop,"During World War II, an American serviceman in London decides to impress his English girlfriend by acting as an American gangster, which soon turns deadly.",1h 43m,Chicago Joe and the Showgirl
116,6.2,30%,Tony Scott,Jim HarrisonJeffrey Alan Fiskin,"A retired US Navy pilot comes to Mexico, where he falls in love with the wife of a powerful businessman. The consequences will be cruel and unforeseen.",2h 4m,Revenge
117,7.2,--,Rita Horst,Rita Horst,Anne and Matthijs learn that their unborn child won't survive for long.,1h 34m,Romeo
118,6.7,70%,Claire Denis,Claire DenisJean-Pol Fargeau,"Dah and Jocelyn come from Benin, Africa, to coach their rooster, ""S'en fout la mort"", for an illicit cock-fight in the basement of a restaurant.",1h 30m,"No Fear, No Die"
119,5.7,--,Suzanne Osten,Etienne GlaserMadeleine GustafssonRicarda Huch,"In a fictional country, around 1912, student are rioting. There are cries for democracy and to overthrow of the old regime. The revolt is brutally downcast by the regime's forces. The leader of the rebellion is arrested.",1h 48m,The Guardian Angel
120,5.9,--,Norman Loftis,Norman Loftis,A supremely realistic film of repression in the inter-city ghetto.,1h 28m,Small Time
121,7.1,--,Paolo TavianiVittorio Taviani,Vittorio TavianiPaolo TavianiLev Tolstoy,"Young nobleman Baron Sergio Giuramondo, after discovering that his bride-to-be was the king's mistress, leaves Naples in disgust to become a monk. But his quest for perfect solitude is constantly interrupted by visitors hearing rumours that Sergio possesses miraculous powers, and by women who bet each other that they can successfully seduce him...",1h 53m,Trail of the Beast
122,7.0,--,Georgi Djulgerov,Georgi DanailovGeorgi Djulgerov,"A hot summer in the middle of the 50's. A pioneer's camp. 12 years old Dimana and Todor, while being on a guard of honor at a giant monument of Stalin, experience their first kiss. Literally, Stalin's shadow shelters them but figuratively, it separates them. They face their first moral disillusionment. 10 years later they meet in the same place. Todor is now a promisi... Read all",1h 30m,Lagerat
123,6.2,40%,Franco Amurri,David Loughery,At last the Feds have caught him! Infamous 60's radical Huey Walker is heading for jail. So how come it's Huey's yuptight FBI escort who ends up behind bars?,1h 48m,Flashback
124,6.3,--,Miguel Littin,John BrileyLeonardo BenvenutiGiovanna Koch,The US tried to occupy Nicaragua in 1927. General Cesar Augusto Sandino and his guerrillas begin armed resistance.,2h 15m,Sandino
125,6.6,--,André Melançon,Denis BouchardMarcel LeboeufAndré Melançon,On Christmas eve a journalist witnesses a theft in a mall and then tracks one of the thieves to later be taken as his hostage in the radio station he works for.,1h 28m,Rafales
126,7.0,--,Rita Azevedo Gomes,Rita Azevedo Gomes,"An author writes a story entitled ""O som da terra a tremer"", and the story constantly entwines itself with his private life.",1h 30m,O Som da Terra a Tremer
127,6.8,--,Helmut Dziuba,Helmut DziubaPeter JakubeitHelmut H. Schulz,"18-year old-Georg and 13-year-old Barbara played together as children; later, play becomes love, which leads to a catastrophe, as their parents are hostile, leading to a report being filed to the court, as Barbara is underage.",1h 31m,Forbidden Love
128,5.6,--,Vladimir Popkov,Roman FurmanOleg Kolesnikov,Add a plot,1h 30m,Doping dlya angelov
129,5.4,--,Houchang Allahyari,Houchang AllahyariTom-Dariusch Allahyari,Add a plot,1h 10m,Fleischwolf
130,5.7,--,Jürgen Brauer,Jürgen BrauerJurij Koch,"Ena is engaged to the young farmer and neighbor Mathias. After his sudden death, she marries the engineer Sieghart and travels with him to Paris. But she never really gets rid of Mathias.",1h 34m,Sehnsucht
131,5.6,--,David Hayman,Bill BeechJane Beech,"In London 1963, Larry Winters (Iain Glen) murders a bartender. Sentenced to life Winters has fits of rage which continue until prison doctors put him in an experimental unit. Flashbacks to his childhood and his history of drug abuse show how this troubled man became a murderer.",1h 25m,Silent Scream
132,5.3,25%,Bruno Barreto,Anne NelsonEvan JonesJohn Strong,An American journalist in Puerto Rico in 1978 investigates the death of nationalists who may have been murdered by the police.,1h 35m,A Show of Force
133,5.8,64%,Katt Shea,Andy RubenKatt Shea,"The story of runaways living in Venice, California, under the threat of a psychotic cop who is a serial killer of prostitutes.",1h 25m,Streets
134,4.8,--,Pierre Beuchot,Pierre BeuchotCatherine BreillatPierre-Jean Jouve,"In Paris, unhappy movie actress Catherine Crachat becomes infatuated with the mathematician Pierre Indemini, but then breaks up with him. After a film shoot in Vienna, Catherine stays with a rich admirer, Fanny Hohenstein. Fanny has a history of many lovers of both sexes, two of whom killed themselves over her.",1h 40m,Aventure de Catherine C.
135,5.8,--,Fyodor Petrukhin,Fyodor Petrukhin,"Dina's father, a district doctor, mysteriously disappears. After this event, Dinu is visited at night by a ghost predicting misfortune for his fellow villagers. Dina tries to warn trouble, but they do not believe her.",1h 27m,Dina
136,6.3,--,Vladimir Khotinenko,Sergei AlekseyevVladimir KhotinenkoVioletta Sedova,,2h 28m,Roy
137,4.8,--,Egon Günther,Egon Günther,Add a plot,1h 30m,Rosamunde
138,4.0,--,Antonio Bonifacio,Daniele Stroppa,"Gianni is a political man with a good career waiting for him. Angela is his wife and she fakes an assault and a rape in a cinema. Eva is Gianni's lover and Angela's friend. Gianni and Eva decide to use the pretext of the assault to kill Angela. Later on Angela is blackmailed by a man who was present at her act. In the background there are Rosy, her maid always present... Read all",1h 28m,Scandal in Black
139,5.0,38%,Eric Karson,Stefani Warren,Tenant helps landlord fight off local street gang.,1h 46m,Angel Town
140,6.0,--,Tristán Bauer,Tristán BauerGraciela MaglieAldo Romero,"A married couple with two children living in the suburbs of Buenos Aires have economical troubles. The father returns to his rural birthplace, where he finds that his father and brother are out of work, so he decides to the city.",1h 45m,Después de la tormenta
141,6.6,69%,Indra Kumar,Rajeev KaulNaushir KhatauKamlesh Pandey,"A man pretends to be a rich industrialist to improve his son's chances of marrying in to wealth, but his plan backfires on him.",2h 52m,Dil
142,6.6,--,Ray Argall,Ray Argall,"A man and his wife are partners in a small business, a service station, that is stuggling to survive financially. They are visited by his brother, a divorced middle-aged man, who has taken a break from his stressful career in a big business corporation.",1h 27m,Return Home
143,7.0,54%,Shun Nakahara,Hiroaki JinnoAkimi Yoshida,"The film offers a glimpse at a group of school girls who are very flexible in terms of gender roles, playing males both in the school play and in real life. A modern-day all girls high school traditionally celebrates its anniversary by staging Chekov's play, but this year the faculty may cancel the play because Noriko, a senior, was seen smoking in a coffee shop with ... Read all",1h 36m,The Cherry Orchard
144,7.7,70%,Giuseppe Tornatore,Massimo De RitaTonino GuerraGiuseppe Tornatore,Matteo decides to take a trip across Italy to go visiting his five children.,1h 58m,Everybody's Fine
145,7.0,--,Arvo Kruusement,Oskar LutsMats Traat,"In the follow-up of ""Kevade"" and ""Suvi"" the same characters have reached their middle-age. Everybody are living quiet family-life but Kiir the tailor who one more time decides to become a farmer and get married.",1h 25m,Sügis
146,4.9,--,Deepak Balraj Vij,Kalaivanan KannadasanAchala NagarReema Rakesh Nath,"Krishna is suffering from memory loss and is under the guidance of Dr Sushma. They fall in love and get married, but when Krishna gains his memory he tries to kill Dr Sushma.",--,Sailaab
147,7.8,84%,Penny Marshall,Oliver SacksSteven Zaillian,"The victims of an encephalitis epidemic many years ago have been catatonic ever since, but now a new drug offers the prospect of reviving them.",2h 1m,Awakenings
148,8.2,97%,Mani Ratnam,Mani RatnamJaved Siddiqui,"After a few years, Chitra learns that her child, who was believed to be dead, is alive but is suffering from a mental illness. However, her family faces many challenges while looking after her child.",2h 30m,Anjali
149,5.4,29%,Michael Cimino,Joseph HayesLawrence KonnerMark Rosenthal,"An escaped con, on the run from the law, moves into a married couple's house and takes over their lives.",1h 45m,Desperate Hours
